CLTS_NAME	BIPA_GRAPHEME	EURASIAN_URL	EURASIAN_GRAPHEME
from back rounded open-mid back to front unrounded close-mid front diphthong	ɔe	http://eurasianphonology.info/search_exact?dialects=True&query=ɔe	ɔe
aspirated voiceless apical alveolar stop consonant	t̺ʰ	http://eurasianphonology.info/search_exact?dialects=True&query=t̺ʰ	t̺ʰ
voiceless apical alveolar ejective stop consonant	t̺’	http://eurasianphonology.info/search_exact?dialects=True&query=t̺ʼ	t̺ʼ
voiceless apical uvular stop consonant	q̺	http://eurasianphonology.info/search_exact?dialects=True&query=q̺	q̺
from voiceless apical alveolar stop to voiceless apical alveolo-palatal sibilant fricative cluster	t̺ɕ̺	http://eurasianphonology.info/search_exact?dialects=True&query=t̺ɕ̺	t̺ɕ̺
from voiceless apical alveolar stop to voiceless apical alveolo-palatal ejective sibilant fricative cluster	t̺ɕ̺’	http://eurasianphonology.info/search_exact?dialects=True&query=t̺ɕ̺ʼ	t̺ɕ̺ʼ
back less-rounded rounded mid back vowel	o̞̜	http://eurasianphonology.info/search_exact?dialects=True&query=o̞̜	o̞̜
back less-rounded rounded close back vowel	u̜	http://eurasianphonology.info/search_exact?dialects=True&query=u̜	u̜
long voiceless post-alveolar ejective sibilant affricate consonant	tʃʼː	http://eurasianphonology.info/search_exact?dialects=True&query=tʃːʼ	tʃːʼ
long voiceless alveolar ejective sibilant affricate consonant	tsʼː	http://eurasianphonology.info/search_exact?dialects=True&query=tsːʼ	tsːʼ
long voiceless alveolar ejective lateral affricate consonant	tɬʼː	http://eurasianphonology.info/search_exact?dialects=True&query=tɬːʼ	tɬːʼ
long voiceless palatal sibilant fricative consonant	çː	http://eurasianphonology.info/search_exact?dialects=True&query=çː	çː
aspirated long voiceless velar affricate consonant	kxʰː	http://eurasianphonology.info/search_exact?dialects=True&query=kxːʰ	kxːʰ
long voiceless velar ejective affricate consonant	kx’ː	http://eurasianphonology.info/search_exact?dialects=True&query=kxːʼ	kxːʼ
aspirated long voiceless uvular affricate consonant	qχʰː	http://eurasianphonology.info/search_exact?dialects=True&query=qχːʰ	qχːʰ
long voiceless uvular ejective affricate consonant	qχ’ː	http://eurasianphonology.info/search_exact?dialects=True&query=qχːʼ	qχːʼ
lowered front nasalized unrounded close front vowel	ĩ̞	http://eurasianphonology.info/search_exact?dialects=True&query=ĩ̞	ĩ̞
long voiceless post-alveolar ejective sibilant fricative consonant	ʃʼː	http://eurasianphonology.info/search_exact?dialects=True&query=ʃːʼ	ʃːʼ
long voiceless alveolar ejective sibilant fricative consonant	sʼː	http://eurasianphonology.info/search_exact?dialects=True&query=sːʼ	sːʼ
long voiceless uvular ejective fricative consonant	χʼː	http://eurasianphonology.info/search_exact?dialects=True&query=χːʼ	χːʼ
breathy voiced palatal stop consonant	ɟʱ	http://eurasianphonology.info/search_exact?dialects=True&query=ɟʱ	ɟʱ
palatalized voiced apical alveolar trill consonant	r̺ʲ	http://eurasianphonology.info/search_exact?dialects=True&query=r̺ʲ	r̺ʲ
voiced uvular nasal consonant	ɴ	http://eurasianphonology.info/search_exact?dialects=True&query=ɴ	ɴ
long central advanced unrounded close central vowel	ɨ̟ː	http://eurasianphonology.info/search_exact?dialects=True&query=ɨ̟ː	ɨ̟ː
back advanced unrounded close-mid back vowel	ɤ̟	http://eurasianphonology.info/search_exact?dialects=True&query=ɤ̟	ɤ̟
long back advanced unrounded close-mid back vowel	ɤ̟ː	http://eurasianphonology.info/search_exact?dialects=True&query=ɤ̟ː	ɤ̟ː
long lowered front unrounded open-mid front vowel	ɛ̞ː	http://eurasianphonology.info/search_exact?dialects=True&query=ɛ̞ː	ɛ̞ː
from lowered front rounded open-mid front to lowered front unrounded open-mid front diphthong	œ̞ɛ̞	http://eurasianphonology.info/search_exact?dialects=True&query=œ̞ɛ̞	œ̞ɛ̞
long central advanced rounded close-mid central vowel	ɵ̟ː	http://eurasianphonology.info/search_exact?dialects=True&query=ɵ̟ː	ɵ̟ː
from pre-nasalized voiced dental stop to voiced dental sibilant fricative cluster	ⁿd̪z̪	http://eurasianphonology.info/search_exact?dialects=True&query=ⁿd̪z̪	ⁿd̪z̪
syllabic voiced alveolar sibilant fricative consonant	z̩	http://eurasianphonology.info/search_exact?dialects=True&query=z̩	z̩
rhotacized central unrounded mid central vowel	ə˞	http://eurasianphonology.info/search_exact?dialects=True&query=ə˞	ə˞
central nasalized unrounded close-mid central vowel	ɘ̃	http://eurasianphonology.info/search_exact?dialects=True&query=ɘ̃	ɘ̃
from front unrounded close front to central unrounded open-mid central diphthong	iɜ	http://eurasianphonology.info/search_exact?dialects=True&query=iɜ	iɜ
from front unrounded close front to front nasalized unrounded open-mid front diphthong	iɛ̃	http://eurasianphonology.info/search_exact?dialects=True&query=iɛ̃	iɛ̃
from front rounded close front to front nasalized unrounded close front diphthong	yĩ	http://eurasianphonology.info/search_exact?dialects=True&query=yĩ	yĩ
from front unrounded close front to front nasalized unrounded nearly-open front diphthong	iæ̃	http://eurasianphonology.info/search_exact?dialects=True&query=iæ̃	iæ̃
from front rounded close front to front unrounded close front diphthong	yi	http://eurasianphonology.info/search_exact?dialects=True&query=yi	yi
from front rounded close front to central unrounded open-mid central diphthong	yɜ	http://eurasianphonology.info/search_exact?dialects=True&query=yɜ	yɜ
from back rounded close back to central unrounded open-mid central diphthong	uɜ	http://eurasianphonology.info/search_exact?dialects=True&query=uɜ	uɜ
from back rounded close back to front nasalized unrounded open-mid front diphthong	uɛ̃	http://eurasianphonology.info/search_exact?dialects=True&query=uɛ̃	uɛ̃
from back rounded close back to front nasalized unrounded open front diphthong	uã	http://eurasianphonology.info/search_exact?dialects=True&query=uã	uã
palatalized aspirated voiceless alveolar sibilant fricative consonant	sʲʰ	http://eurasianphonology.info/search_exact?dialects=True&query=sʲʰ	sʲʰ
front breathy rounded close front vowel	y̤	http://eurasianphonology.info/search_exact?dialects=True&query=y̤	y̤
front breathy rounded close-mid front vowel	ø̤	http://eurasianphonology.info/search_exact?dialects=True&query=ø̤	ø̤
front nasalized breathy unrounded open front vowel	ã̤	http://eurasianphonology.info/search_exact?dialects=True&query=ã̤	ã̤
front creaky rounded close front vowel	y̰	http://eurasianphonology.info/search_exact?dialects=True&query=y̰	y̰
back creaky unrounded close back vowel	ɯ̰	http://eurasianphonology.info/search_exact?dialects=True&query=ɯ̰	ɯ̰
front creaky rounded close-mid front vowel	ø̰	http://eurasianphonology.info/search_exact?dialects=True&query=ø̰	ø̰
central creaky unrounded mid central vowel	ə̰	http://eurasianphonology.info/search_exact?dialects=True&query=ə̰	ə̰
back creaky rounded close-mid back vowel	o̰	http://eurasianphonology.info/search_exact?dialects=True&query=o̰	o̰
back creaky rounded open-mid back vowel	ɔ̰	http://eurasianphonology.info/search_exact?dialects=True&query=ɔ̰	ɔ̰
syllabic voiced bilabial nasal consonant	m̩	http://eurasianphonology.info/search_exact?dialects=True&query=m̩	m̩
back breathy unrounded open-mid back vowel	ʌ̤	http://eurasianphonology.info/search_exact?dialects=True&query=ʌ̤	ʌ̤
back breathy unrounded open back vowel	ɑ̤	http://eurasianphonology.info/search_exact?dialects=True&query=ɑ̤	ɑ̤
from central unrounded close central to front unrounded open-mid front diphthong	ɨɛ	http://eurasianphonology.info/search_exact?dialects=True&query=ɨɛ	ɨɛ
central unrounded close with-frication central vowel	ʅ	http://eurasianphonology.info/search_exact?dialects=True&query=ʅ	ʅ
from back rounded close-mid back to front unrounded close front diphthong	oi	http://eurasianphonology.info/search_exact?dialects=True&query=oi	oi
voiced apical alveolar sibilant affricate consonant	dz̺	http://eurasianphonology.info/search_exact?dialects=True&query=dz̺	dz̺
lowered back rounded open-mid back vowel	ɔ̞	http://eurasianphonology.info/search_exact?dialects=True&query=ɔ̞	ɔ̞
central more-rounded unrounded mid central vowel	ə̹	http://eurasianphonology.info/search_exact?dialects=True&query=ə̹	ə̹
lowered front unrounded open-mid front vowel	ɛ̞	http://eurasianphonology.info/search_exact?dialects=True&query=ɛ̞	ɛ̞
long voiceless glottal stop consonant	ʔː	http://eurasianphonology.info/search_exact?dialects=True&query=ʔː	ʔː
from back rounded close back to back unrounded open-mid back diphthong	uʌ	http://eurasianphonology.info/search_exact?dialects=True&query=uʌ	uʌ
non-syllabic near-back rounded near-close near-back vowel	ʊ̯	http://eurasianphonology.info/search_exact?dialects=True&query=ʊ̯	ʊ̯
palatalized voiced velar stop consonant	gʲ	http://eurasianphonology.info/search_exact?dialects=True&query=ɡʲ	ɡʲ
non-syllabic near-front unrounded near-close near-front vowel	ɪ̯	http://eurasianphonology.info/search_exact?dialects=True&query=ɪ̯	ɪ̯
from long front unrounded open front to front unrounded close front diphthong	aːi	http://eurasianphonology.info/search_exact?dialects=True&query=aːi	aːi
labialized aspirated voiceless dental stop consonant	t̪ʷʰ	http://eurasianphonology.info/search_exact?dialects=True&query=t̪ʰʷ	t̪ʰʷ
labialized voiceless dental stop consonant	t̪ʷ	http://eurasianphonology.info/search_exact?dialects=True&query=t̪ʷ	t̪ʷ
labialized voiceless dental ejective stop consonant	t̪ʼʷ	http://eurasianphonology.info/search_exact?dialects=True&query=t̪ʼʷ	t̪ʼʷ
labialized voiceless dental sibilant affricate consonant	ts̪ʷ	http://eurasianphonology.info/search_exact?dialects=True&query=t̪s̪ʷ	t̪s̪ʷ
labialized voiceless dental ejective sibilant affricate consonant	ts̪ʼʷ	http://eurasianphonology.info/search_exact?dialects=True&query=t̪s̪ʼʷ	t̪s̪ʼʷ
labialized voiceless dental sibilant fricative consonant	s̪ʷ	http://eurasianphonology.info/search_exact?dialects=True&query=s̪ʷ	s̪ʷ
labialized voiced dental sibilant fricative consonant	z̪ʷ	http://eurasianphonology.info/search_exact?dialects=True&query=z̪ʷ	z̪ʷ
palatalized voiceless bilabial ejective stop consonant	pʼʲ	http://eurasianphonology.info/search_exact?dialects=True&query=pʼʲ	pʼʲ
palatalized aspirated voiceless dental stop consonant	t̪ʰʲ	http://eurasianphonology.info/search_exact?dialects=True&query=t̪ʰʲ	t̪ʰʲ
palatalized voiceless dental ejective stop consonant	t̪ʼʲ	http://eurasianphonology.info/search_exact?dialects=True&query=t̪ʼʲ	t̪ʼʲ
palatalized labialized aspirated voiceless dental stop consonant	t̪ʲʷʰ	http://eurasianphonology.info/search_exact?dialects=True&query=t̪ʰʷʲ	t̪ʰʷʲ
palatalized labialized voiceless dental stop consonant	t̪ʲʷ	http://eurasianphonology.info/search_exact?dialects=True&query=t̪ʷʲ	t̪ʷʲ
palatalized labialized voiceless dental ejective stop consonant	t̪ʼʲʷ	http://eurasianphonology.info/search_exact?dialects=True&query=t̪ʼʷʲ	t̪ʼʷʲ
palatalized voiceless dental sibilant affricate consonant	ts̪ʲ	http://eurasianphonology.info/search_exact?dialects=True&query=t̪s̪ʲ	t̪s̪ʲ
palatalized voiceless dental ejective sibilant affricate consonant	ts̪ʼʲ	http://eurasianphonology.info/search_exact?dialects=True&query=t̪s̪ʼʲ	t̪s̪ʼʲ
palatalized labialized voiceless dental sibilant affricate consonant	ts̪ʲʷ	http://eurasianphonology.info/search_exact?dialects=True&query=t̪s̪ʷʲ	t̪s̪ʷʲ
palatalized labialized voiceless dental ejective sibilant affricate consonant	ts̪ʼʲʷ	http://eurasianphonology.info/search_exact?dialects=True&query=t̪s̪ʼʷʲ	t̪s̪ʼʷʲ
palatalized voiceless dental sibilant fricative consonant	s̪ʲ	http://eurasianphonology.info/search_exact?dialects=True&query=s̪ʲ	s̪ʲ
palatalized labialized voiceless dental sibilant fricative consonant	s̪ʲʷ	http://eurasianphonology.info/search_exact?dialects=True&query=s̪ʷʲ	s̪ʷʲ
palatalized voiceless velar ejective stop consonant	kʼʲ	http://eurasianphonology.info/search_exact?dialects=True&query=kʼʲ	kʼʲ
palatalized labialized voiceless velar stop consonant	kʲʷ	http://eurasianphonology.info/search_exact?dialects=True&query=kʷʲ	kʷʲ
palatalized labialized aspirated voiceless velar stop consonant	kʲʷʰ	http://eurasianphonology.info/search_exact?dialects=True&query=kʰʷʲ	kʰʷʲ
palatalized labialized voiceless velar ejective stop consonant	kʼʲʷ	http://eurasianphonology.info/search_exact?dialects=True&query=kʼʷʲ	kʼʷʲ
palatalized voiceless uvular stop consonant	qʲ	http://eurasianphonology.info/search_exact?dialects=True&query=qʲ	qʲ
palatalized aspirated voiceless uvular stop consonant	qʲʰ	http://eurasianphonology.info/search_exact?dialects=True&query=qʰʲ	qʰʲ
palatalized voiceless uvular ejective stop consonant	qʼʲ	http://eurasianphonology.info/search_exact?dialects=True&query=qʼʲ	qʼʲ
palatalized labialized voiceless uvular ejective stop consonant	qʼʲʷ	http://eurasianphonology.info/search_exact?dialects=True&query=qʼʷʲ	qʼʷʲ
palatalized labialized aspirated voiceless uvular stop consonant	qʲʷʰ	http://eurasianphonology.info/search_exact?dialects=True&query=qʰʷʲ	qʰʷʲ
palatalized labialized voiceless uvular stop consonant	qʲʷ	http://eurasianphonology.info/search_exact?dialects=True&query=qʷʲ	qʷʲ
palatalized labialized voiceless uvular fricative consonant	χʲʷ	http://eurasianphonology.info/search_exact?dialects=True&query=χʷʲ	χʷʲ
from non-syllabic front rounded close front to front rounded close-mid front diphthong	y̯ø	http://eurasianphonology.info/search_exact?dialects=True&query=y̯ø	y̯ø
from front rounded close front to front rounded close-mid front diphthong	yø	http://eurasianphonology.info/search_exact?dialects=True&query=yø	yø
from front unrounded close front to front nasalized unrounded close-mid front diphthong	iẽ	http://eurasianphonology.info/search_exact?dialects=True&query=iẽ	iẽ
long front nasalized unrounded mid front vowel	ẽ̞ː	http://eurasianphonology.info/search_exact?dialects=True&query=ẽ̞ː	ẽ̞ː
from front unrounded close front to long front nasalized unrounded close-mid front diphthong	iẽː	http://eurasianphonology.info/search_exact?dialects=True&query=iẽː	iẽː
pre-aspirated long voiceless bilabial stop consonant	ʰpː	http://eurasianphonology.info/search_exact?dialects=True&query=ʰpː	ʰpː
long voiced bilabial nasal consonant	mː	http://eurasianphonology.info/search_exact?dialects=True&query=mː	mː
long voiceless labio-dental fricative consonant	fː	http://eurasianphonology.info/search_exact?dialects=True&query=fː	fː
long voiced labio-dental fricative consonant	vː	http://eurasianphonology.info/search_exact?dialects=True&query=vː	vː
pre-aspirated long voiceless alveolar stop consonant	ʰtː	http://eurasianphonology.info/search_exact?dialects=True&query=ʰtː	ʰtː
from pre-aspirated voiceless alveolar stop to long voiceless alveolar sibilant fricative cluster	ʰtsː	http://eurasianphonology.info/search_exact?dialects=True&query=ʰtsː	ʰtsː
long voiced alveolar nasal consonant	nː	http://eurasianphonology.info/search_exact?dialects=True&query=nː	nː
long voiced alveolar lateral approximant consonant	lː	http://eurasianphonology.info/search_exact?dialects=True&query=lː	lː
from pre-aspirated voiceless alveolar stop to long voiceless post-alveolar sibilant fricative cluster	ʰtʃː	http://eurasianphonology.info/search_exact?dialects=True&query=ʰtʃː	ʰtʃː
long voiced palatal nasal consonant	ɲː	http://eurasianphonology.info/search_exact?dialects=True&query=ɲː	ɲː
long voiced palatal approximant consonant	jː	http://eurasianphonology.info/search_exact?dialects=True&query=jː	jː
pre-aspirated long voiceless velar stop consonant	ʰkː	http://eurasianphonology.info/search_exact?dialects=True&query=ʰkː	ʰkː
long voiced velar nasal consonant	ŋː	http://eurasianphonology.info/search_exact?dialects=True&query=ŋː	ŋː
long voiced dental fricative consonant	ðː	http://eurasianphonology.info/search_exact?dialects=True&query=ðː	ðː
from near-back rounded near-close near-back to front unrounded open front diphthong	ʊa	http://eurasianphonology.info/search_exact?dialects=True&query=ʊa	ʊa
palatalized voiced bilabial fricative consonant	βʲ	http://eurasianphonology.info/search_exact?dialects=True&query=βʲ	βʲ
palatalized devoiced voiced bilabial nasal consonant	m̥ʲ	http://eurasianphonology.info/search_exact?dialects=True&query=m̥ʲ	m̥ʲ
palatalized devoiced voiced alveolar nasal consonant	n̥ʲ	http://eurasianphonology.info/search_exact?dialects=True&query=n̥ʲ	n̥ʲ
long voiced bilabial fricative consonant	βː	http://eurasianphonology.info/search_exact?dialects=True&query=βː	βː
long devoiced voiced alveolar stop consonant	d̥ː	http://eurasianphonology.info/search_exact?dialects=True&query=d̥ː	d̥ː
long devoiced voiced bilabial stop consonant	b̥ː	http://eurasianphonology.info/search_exact?dialects=True&query=b̥ː	b̥ː
long devoiced voiced bilabial nasal consonant	m̥ː	http://eurasianphonology.info/search_exact?dialects=True&query=m̥ː	m̥ː
long voiced alveolar sibilant fricative consonant	zː	http://eurasianphonology.info/search_exact?dialects=True&query=zː	zː
long devoiced voiced alveolar nasal consonant	n̥ː	http://eurasianphonology.info/search_exact?dialects=True&query=n̥ː	n̥ː
long devoiced voiced alveolar lateral approximant consonant	l̥ː	http://eurasianphonology.info/search_exact?dialects=True&query=l̥ː	l̥ː
long voiceless retroflex sibilant fricative consonant	ʂː	http://eurasianphonology.info/search_exact?dialects=True&query=ʂː	ʂː
long voiceless alveolo-palatal sibilant affricate consonant	tɕː	http://eurasianphonology.info/search_exact?dialects=True&query=tɕː	tɕː
long devoiced voiced alveolar trill consonant	r̥ː	http://eurasianphonology.info/search_exact?dialects=True&query=r̥ː	r̥ː
long voiced palatal fricative consonant	ʝː	http://eurasianphonology.info/search_exact?dialects=True&query=ʝː	ʝː
palatalized long voiced bilabial fricative consonant	βʲː	http://eurasianphonology.info/search_exact?dialects=True&query=βʲː	βʲː
palatalized long voiceless labio-dental fricative consonant	fʲː	http://eurasianphonology.info/search_exact?dialects=True&query=fʲː	fʲː
palatalized long voiced bilabial stop consonant	bʲː	http://eurasianphonology.info/search_exact?dialects=True&query=bʲː	bʲː
palatalized long voiceless bilabial stop consonant	pʲː	http://eurasianphonology.info/search_exact?dialects=True&query=pʲː	pʲː
palatalized long voiced bilabial nasal consonant	mʲː	http://eurasianphonology.info/search_exact?dialects=True&query=mʲː	mʲː
palatalized long devoiced voiced bilabial nasal consonant	m̥ʲː	http://eurasianphonology.info/search_exact?dialects=True&query=m̥ʲː	m̥ʲː
palatalized long voiced alveolar sibilant fricative consonant	zʲː	http://eurasianphonology.info/search_exact?dialects=True&query=zʲː	zʲː
palatalized long voiceless alveolar sibilant fricative consonant	sʲː	http://eurasianphonology.info/search_exact?dialects=True&query=sʲː	sʲː
palatalized long voiced alveolar nasal consonant	nʲː	http://eurasianphonology.info/search_exact?dialects=True&query=nʲː	nʲː
palatalized long voiced alveolar lateral approximant consonant	lʲː	http://eurasianphonology.info/search_exact?dialects=True&query=lʲː	lʲː
palatalized long devoiced voiced alveolar nasal consonant	n̥ʲː	http://eurasianphonology.info/search_exact?dialects=True&query=n̥ʲː	n̥ʲː
palatalized long devoiced voiced alveolar lateral approximant consonant	l̥ʲː	http://eurasianphonology.info/search_exact?dialects=True&query=l̥ʲː	l̥ʲː
palatalized long voiceless alveolar sibilant affricate consonant	tsʲː	http://eurasianphonology.info/search_exact?dialects=True&query=tsʲː	tsʲː
palatalized long voiced alveolar trill consonant	rʲː	http://eurasianphonology.info/search_exact?dialects=True&query=rʲː	rʲː
palatalized long devoiced voiced alveolar trill consonant	r̥ʲː	http://eurasianphonology.info/search_exact?dialects=True&query=r̥ʲː	r̥ʲː
palatalized long voiceless velar fricative consonant	xʲː	http://eurasianphonology.info/search_exact?dialects=True&query=xʲː	xʲː
palatalized long voiced velar stop consonant	gʲː	http://eurasianphonology.info/search_exact?dialects=True&query=gʲː	gʲː
palatalized long voiceless velar stop consonant	kʲː	http://eurasianphonology.info/search_exact?dialects=True&query=kʲː	kʲː
palatalized long voiced velar nasal consonant	ŋʲː	http://eurasianphonology.info/search_exact?dialects=True&query=ŋʲː	ŋʲː
from devoiced voiced alveolar stop to devoiced voiced alveolar sibilant fricative cluster	d̥z̥	http://eurasianphonology.info/search_exact?dialects=True&query=d̥z̥	d̥z̥
from devoiced voiced alveolar stop to devoiced voiced alveolo-palatal sibilant fricative cluster	d̥ʑ̥	http://eurasianphonology.info/search_exact?dialects=True&query=d̥ʑ̥	d̥ʑ̥
from devoiced voiced alveolar stop to palatalized devoiced voiced alveolar sibilant fricative cluster	d̥z̥ʲ	http://eurasianphonology.info/search_exact?dialects=True&query=d̥z̥ʲ	d̥z̥ʲ
from pre-aspirated voiceless alveolar stop to voiceless alveolo-palatal sibilant fricative cluster	ʰtɕ	http://eurasianphonology.info/search_exact?dialects=True&query=ʰtɕ	ʰtɕ
pre-aspirated palatalized voiceless bilabial stop consonant	ʰpʲ	http://eurasianphonology.info/search_exact?dialects=True&query=ʰpʲ	ʰpʲ
pre-aspirated palatalized voiceless alveolar stop consonant	ʰtʲ	http://eurasianphonology.info/search_exact?dialects=True&query=ʰtʲ	ʰtʲ
pre-aspirated palatalized voiceless velar stop consonant	ʰkʲ	http://eurasianphonology.info/search_exact?dialects=True&query=ʰkʲ	ʰkʲ
from pre-aspirated voiceless alveolar stop to palatalized voiceless alveolar sibilant fricative cluster	ʰtsʲ	http://eurasianphonology.info/search_exact?dialects=True&query=ʰtsʲ	ʰtsʲ
from back rounded close back to front unrounded mid front diphthong	ue̞	http://eurasianphonology.info/search_exact?dialects=True&query=ue̞	ue̞
devoiced voiced apical alveolar stop consonant	d̺̥	http://eurasianphonology.info/search_exact?dialects=True&query=d̺̥	d̺̥
from voiceless apical alveolar stop to aspirated voiceless apical alveolar sibilant fricative cluster	t̺s̺ʰ	http://eurasianphonology.info/search_exact?dialects=True&query=t̺s̺ʰ	t̺s̺ʰ
from devoiced voiced apical alveolar stop to devoiced voiced apical alveolar sibilant fricative cluster	d̺̥z̺̥	http://eurasianphonology.info/search_exact?dialects=True&query=d̺̥z̺̥	d̺̥z̺̥
from voiceless apical alveolar stop to voiceless apical alveolar ejective sibilant fricative cluster	t̺s̺’	http://eurasianphonology.info/search_exact?dialects=True&query=t̺s̺ʼ	t̺s̺ʼ
from devoiced voiced alveolar stop to devoiced voiced post-alveolar sibilant fricative cluster	d̥ʒ̥	http://eurasianphonology.info/search_exact?dialects=True&query=d̥ʒ̥	d̥ʒ̥
ultra-short central unrounded close central vowel	ɨ̆	http://eurasianphonology.info/search_exact?dialects=True&query=ɨ̆	ɨ̆
from voiceless apical alveolar stop to long voiceless apical alveolar sibilant fricative cluster	t̺s̺ː	http://eurasianphonology.info/search_exact?dialects=True&query=t̺s̺ː	t̺s̺ː
raised back more-rounded unrounded open back vowel	ɑ̝̹	http://eurasianphonology.info/search_exact?dialects=True&query=ɑ̝̹	ɑ̝̹
ultra-short back rounded close back vowel	ŭ	http://eurasianphonology.info/search_exact?dialects=True&query=ŭ	ŭ
lowered front rounded open-mid front vowel	œ̞	http://eurasianphonology.info/search_exact?dialects=True&query=œ̞	œ̞
long lowered front rounded open-mid front vowel	œ̞ː	http://eurasianphonology.info/search_exact?dialects=True&query=œ̞ː	œ̞ː
long near-back unrounded near-close near-back vowel	ɯ̽ː	http://eurasianphonology.info/search_exact?dialects=True&query=ɯ̽ː	ɯ̽ː
long back creaky unrounded open back vowel	ɑ̰ː	http://eurasianphonology.info/search_exact?dialects=True&query=ɑ̰ː	ɑ̰ː
long front creaky unrounded open-mid front vowel	ɛ̰ː	http://eurasianphonology.info/search_exact?dialects=True&query=ɛ̰ː	ɛ̰ː
long front creaky unrounded close front vowel	ḭː	http://eurasianphonology.info/search_exact?dialects=True&query=ḭː	ḭː
long back creaky rounded open-mid back vowel	ɔ̰ː	http://eurasianphonology.info/search_exact?dialects=True&query=ɔ̰ː	ɔ̰ː
long front creaky rounded open-mid front vowel	œ̰ː	http://eurasianphonology.info/search_exact?dialects=True&query=œ̰ː	œ̰ː
long back creaky rounded close back vowel	ṵː	http://eurasianphonology.info/search_exact?dialects=True&query=ṵː	ṵː
long front creaky rounded close front vowel	y̰ː	http://eurasianphonology.info/search_exact?dialects=True&query=y̰ː	y̰ː
front rounded open front vowel	ɶ	http://eurasianphonology.info/search_exact?dialects=True&query=ɶ	ɶ
long front rounded open front vowel	ɶː	http://eurasianphonology.info/search_exact?dialects=True&query=ɶː	ɶː
long central rounded open-mid central vowel	ɞː	http://eurasianphonology.info/search_exact?dialects=True&query=ɞː	ɞː
raised front unrounded open-mid front vowel	ɛ̝	http://eurasianphonology.info/search_exact?dialects=True&query=ɛ̝	ɛ̝
long back advanced unrounded open back vowel	ɑ̟ː	http://eurasianphonology.info/search_exact?dialects=True&query=ɑ̟ː	ɑ̟ː
from central unrounded close central to front unrounded close front diphthong	ɨi	http://eurasianphonology.info/search_exact?dialects=True&query=ɨi	ɨi
