CLTS_NAME	BIPA_GRAPHEME	EURASIAN_URL	EURASIAN_GRAPHEME
long retracted central rounded open-mid central vowel	ɞ̠ː	http://eurasianphonology.info/search_exact?dialects=True&query=ɞ̠ː	ɞ̠ː
long central unrounded close central vowel	ɨː	http://eurasianphonology.info/search_exact?dialects=True&query=ɨː	ɨː
long central unrounded close-mid central vowel	ɘː	http://eurasianphonology.info/search_exact?dialects=True&query=ɘː	ɘː
voiced dental sibilant affricate consonant	dz̪	http://eurasianphonology.info/search_exact?dialects=True&query=d̪z̪	d̪z̪
from back rounded open-mid back to front unrounded close front diphthong	ɔi	http://eurasianphonology.info/search_exact?dialects=True&query=ɔi	ɔi
devoiced voiced apical alveolar trill consonant	r̺̥	http://eurasianphonology.info/search_exact?dialects=True&query=r̺̥	r̺̥
voiceless epiglottal stop consonant	ʡ	http://eurasianphonology.info/search_exact?dialects=True&query=ʡ	ʡ
pharyngealized voiceless dental ejective stop consonant	t̪ʼˤ	http://eurasianphonology.info/search_exact?dialects=True&query=t̪ʼˤ	t̪ʼˤ
pharyngealized voiceless post-alveolar ejective sibilant affricate consonant	tʃʼˤ	http://eurasianphonology.info/search_exact?dialects=True&query=tʃʼˤ	tʃʼˤ
aspirated pharyngealized voiceless dental stop consonant	t̪ʰˤ	http://eurasianphonology.info/search_exact?dialects=True&query=t̪ʰˤ	t̪ʰˤ
aspirated pharyngealized voiceless post-alveolar sibilant affricate consonant	tʃʰˤ	http://eurasianphonology.info/search_exact?dialects=True&query=tʃʰˤ	tʃʰˤ
aspirated pharyngealized voiceless bilabial stop consonant	pʰˤ	http://eurasianphonology.info/search_exact?dialects=True&query=pʰˤ	pʰˤ
aspirated pharyngealized voiceless alveolar sibilant affricate consonant	tsʰˤ	http://eurasianphonology.info/search_exact?dialects=True&query=tsʰˤ	tsʰˤ
pharyngealized voiced dental stop consonant	d̪ˤ	http://eurasianphonology.info/search_exact?dialects=True&query=d̪ˤ	d̪ˤ
pharyngealized voiced alveolar nasal consonant	nˤ	http://eurasianphonology.info/search_exact?dialects=True&query=nˤ	nˤ
pharyngealized voiced labio-dental fricative consonant	vˤ	http://eurasianphonology.info/search_exact?dialects=True&query=vˤ	vˤ
pharyngealized voiced post-alveolar sibilant fricative consonant	ʒˤ	http://eurasianphonology.info/search_exact?dialects=True&query=ʒˤ	ʒˤ
from long front unrounded close front to front unrounded open-mid front diphthong	iːɛ	http://eurasianphonology.info/search_exact?dialects=True&query=iːɛ	iːɛ
from long back rounded close back to back unrounded open-mid back diphthong	uːʌ	http://eurasianphonology.info/search_exact?dialects=True&query=uːʌ	uːʌ
from non-syllabic front unrounded open-mid front to long front unrounded nearly-open front diphthong	ɛ̯æː	http://eurasianphonology.info/search_exact?dialects=True&query=ɛ̯æː	ɛ̯æː
from back rounded open-mid back to long front unrounded open front diphthong	ɔaː	http://eurasianphonology.info/search_exact?dialects=True&query=ɔaː	ɔaː
lowered near-front unrounded near-close near-front vowel	ɪ̞	http://eurasianphonology.info/search_exact?dialects=True&query=ɪ̞	ɪ̞
devoiced voiced dental stop consonant	d̪̥	http://eurasianphonology.info/search_exact?dialects=True&query=d̪̥	d̪̥
aspirated voiceless dental affricate consonant	ts̪ʰ	http://eurasianphonology.info/search_exact?dialects=True&query=t̪s̪ʰ	t̪s̪ʰ
palatalized voiced alveolar lateral fricative consonant	ɮʲ	http://eurasianphonology.info/search_exact?dialects=True&query=ɮʲ	ɮʲ
palatalized devoiced voiced alveolar stop consonant	d̥ʲ	http://eurasianphonology.info/search_exact?dialects=True&query=d̥ʲ	d̥ʲ
aspirated voiceless alveolar lateral affricate consonant	tɬʰ	http://eurasianphonology.info/search_exact?dialects=True&query=tɬʰ	tɬʰ
voiceless alveolar ejective lateral affricate consonant	tɬʼ	http://eurasianphonology.info/search_exact?dialects=True&query=tɬʼ	tɬʼ
voiced epiglottal fricative consonant	ʢ	http://eurasianphonology.info/search_exact?dialects=True&query=ʢ	ʢ
labialized aspirated voiceless alveolar stop consonant	tʷʰ	http://eurasianphonology.info/search_exact?dialects=True&query=tʰʷ	tʰʷ
labialized aspirated voiceless alveolar sibilant affricate consonant	tsʷʰ	http://eurasianphonology.info/search_exact?dialects=True&query=tsʰʷ	tsʰʷ
labialized aspirated voiceless post-alveolar sibilant affricate consonant	tʃʷʰ	http://eurasianphonology.info/search_exact?dialects=True&query=tʃʰʷ	tʃʰʷ
labialized aspirated voiceless alveolar lateral affricate consonant	tɬʷʰ	http://eurasianphonology.info/search_exact?dialects=True&query=tɬʰʷ	tɬʰʷ
labialized aspirated voiceless velar stop consonant	kʷʰ	http://eurasianphonology.info/search_exact?dialects=True&query=kʰʷ	kʰʷ
labialized aspirated voiceless uvular stop consonant	qʷʰ	http://eurasianphonology.info/search_exact?dialects=True&query=qʰʷ	qʰʷ
labialized voiceless alveolar ejective lateral affricate consonant	tɬʼʷ	http://eurasianphonology.info/search_exact?dialects=True&query=tɬʼʷ	tɬʼʷ
labialized voiced epiglottal fricative consonant	ʢʷ	http://eurasianphonology.info/search_exact?dialects=True&query=ʢʷ	ʢʷ
labialized voiceless alveolar lateral fricative consonant	ɬʷ	http://eurasianphonology.info/search_exact?dialects=True&query=ɬʷ	ɬʷ
labialized voiceless epiglottal fricative consonant	ʜʷ	http://eurasianphonology.info/search_exact?dialects=True&query=ʜʷ	ʜʷ
labialized voiceless glottal fricative consonant	hʷ	http://eurasianphonology.info/search_exact?dialects=True&query=hʷ	hʷ
pre-nasalized voiceless bilabial stop consonant	ⁿp	http://eurasianphonology.info/search_exact?dialects=True&query=ⁿp	ⁿp
pre-nasalized voiceless alveolar stop consonant	ⁿt	http://eurasianphonology.info/search_exact?dialects=True&query=ⁿt	ⁿt
pre-nasalized voiceless palatal stop consonant	ⁿc	http://eurasianphonology.info/search_exact?dialects=True&query=ⁿc	ⁿc
pre-nasalized voiceless velar stop consonant	ⁿk	http://eurasianphonology.info/search_exact?dialects=True&query=ⁿk	ⁿk
pre-nasalized voiceless uvular stop consonant	ⁿq	http://eurasianphonology.info/search_exact?dialects=True&query=ⁿq	ⁿq
pre-nasalized aspirated voiceless uvular stop consonant	ⁿqʰ	http://eurasianphonology.info/search_exact?dialects=True&query=ⁿqʰ	ⁿqʰ
from pre-nasalized voiceless alveolar stop to voiceless alveolar sibilant fricative cluster	ⁿts	http://eurasianphonology.info/search_exact?dialects=True&query=ⁿts	ⁿts
pre-nasalized voiceless post-alveolar sibilant affricate consonant	ⁿtʃ	http://eurasianphonology.info/search_exact?dialects=True&query=ⁿtʃ	ⁿtʃ
pre-nasalized voiceless retroflex sibilant affricate consonant	ⁿʈʂ	http://eurasianphonology.info/search_exact?dialects=True&query=ⁿʈʂ	ⁿʈʂ
long voiced bilabial stop consonant	bː	http://eurasianphonology.info/search_exact?dialects=True&query=bː	bː
long voiced alveolar stop consonant	dː	http://eurasianphonology.info/search_exact?dialects=True&query=dː	dː
long voiced post-alveolar sibilant affricate consonant	dʒː	http://eurasianphonology.info/search_exact?dialects=True&query=dʒː	dʒː
long voiced velar stop consonant	gː	http://eurasianphonology.info/search_exact?dialects=True&query=gː	gː
long voiceless alveolar sibilant affricate consonant	tsː	http://eurasianphonology.info/search_exact?dialects=True&query=tsː	tsː
long voiceless alveolar lateral affricate consonant	tɬː	http://eurasianphonology.info/search_exact?dialects=True&query=tɬː	tɬː
long voiceless alveolar ejective sibilant affricate consonant	tsʼː	http://eurasianphonology.info/search_exact?dialects=True&query=tsʼː	tsʼː
long voiceless post-alveolar ejective sibilant affricate consonant	tːʃʼ	http://eurasianphonology.info/search_exact?dialects=True&query=tʃʼː	tʃʼː
long voiceless alveolar ejective lateral affricate consonant	tɬʼː	http://eurasianphonology.info/search_exact?dialects=True&query=tɬʼː	tɬʼː
long voiceless velar ejective stop consonant	kʼː	http://eurasianphonology.info/search_exact?dialects=True&query=kʼː	kʼː
long voiceless uvular ejective stop consonant	qʼː	http://eurasianphonology.info/search_exact?dialects=True&query=qʼː	qʼː
long voiceless alveolar lateral fricative consonant	ɬː	http://eurasianphonology.info/search_exact?dialects=True&query=ɬː	ɬː
labialized long voiced velar stop consonant	gʷː	http://eurasianphonology.info/search_exact?dialects=True&query=gːʷ	gːʷ
labialized long voiceless velar ejective stop consonant	kʼʷː	http://eurasianphonology.info/search_exact?dialects=True&query=kʼːʷ	kʼːʷ
labialized voiced uvular stop consonant	ɢʷ	http://eurasianphonology.info/search_exact?dialects=True&query=ɢʷ	ɢʷ
labialized long voiceless uvular ejective stop consonant	qʼʷː	http://eurasianphonology.info/search_exact?dialects=True&query=qʼːʷ	qʼːʷ
nasalized voiceless glottal stop consonant	ʔ̃	http://eurasianphonology.info/search_exact?dialects=True&query=ʔ̃	ʔ̃
palatalized voiceless dental stop consonant	t̪ʲ	http://eurasianphonology.info/search_exact?dialects=True&query=t̪ʲ	t̪ʲ
palatalized voiced dental stop consonant	d̪ʲ	http://eurasianphonology.info/search_exact?dialects=True&query=d̪ʲ	d̪ʲ
palatalized voiceless glottal fricative consonant	hʲ	http://eurasianphonology.info/search_exact?dialects=True&query=hʲ	hʲ
devoiced voiced velar nasal consonant	ŋ̊	http://eurasianphonology.info/search_exact?dialects=True&query=ŋ̥	ŋ̥
from near-back rounded near-close near-back to front unrounded close front diphthong	ʊi	http://eurasianphonology.info/search_exact?dialects=True&query=ʊi	ʊi
from central unrounded mid central to front unrounded close front diphthong	əi	http://eurasianphonology.info/search_exact?dialects=True&query=əi	əi
from near-front unrounded near-close near-front to back rounded close back diphthong	ɪu	http://eurasianphonology.info/search_exact?dialects=True&query=ɪu	ɪu
aspirated voiced dental stop consonant	d̪ʰ	http://eurasianphonology.info/search_exact?dialects=True&query=d̪ʰ	d̪ʰ
from voiceless laminal retroflex stop to voiceless laminal retroflex sibilant fricative cluster	ʈ̻ʂ̻	http://eurasianphonology.info/search_exact?dialects=True&query=ʈ̻ʂ̻	ʈ̻ʂ̻
from voiced laminal retroflex stop to voiced laminal retroflex sibilant fricative cluster	ɖ̻ʐ̻	http://eurasianphonology.info/search_exact?dialects=True&query=ɖ̻ʐ̻	ɖ̻ʐ̻
voiceless laminal retroflex sibilant fricative consonant	ʂ̻	http://eurasianphonology.info/search_exact?dialects=True&query=ʂ̻	ʂ̻
voiced laminal retroflex sibilant fricative consonant	ʐ̻	http://eurasianphonology.info/search_exact?dialects=True&query=ʐ̻	ʐ̻
central advanced unrounded close-mid central vowel	ɘ̟	http://eurasianphonology.info/search_exact?dialects=True&query=ɘ̟	ɘ̟
non-syllabic back nasalized rounded close back vowel	ũ̯	http://eurasianphonology.info/search_exact?dialects=True&query=ũ̯	ũ̯
non-syllabic front nasalized unrounded close front vowel	ĩ̯	http://eurasianphonology.info/search_exact?dialects=True&query=ĩ̯	ĩ̯
voiced apical alveolar stop consonant	d̺	http://eurasianphonology.info/search_exact?dialects=True&query=d̺	d̺
mid-long front unrounded close front vowel	iˑ	http://eurasianphonology.info/search_exact?dialects=True&query=iˑ	iˑ
from front unrounded open-mid front to non-syllabic back rounded close back diphthong	ɛu̯	http://eurasianphonology.info/search_exact?dialects=True&query=ɛu̯	ɛu̯
long voiced alveolar trill consonant	rː	http://eurasianphonology.info/search_exact?dialects=True&query=rː	rː
from voiceless apical alveolar stop to voiceless apical post-alveolar sibilant fricative cluster	t̺ʃ̺	http://eurasianphonology.info/search_exact?dialects=True&query=t̺ʃ̺	t̺ʃ̺
from voiced apical alveolar stop to voiced apical post-alveolar sibilant fricative cluster	d̺ʒ̺	http://eurasianphonology.info/search_exact?dialects=True&query=d̺ʒ̺	d̺ʒ̺
voiceless apical post-alveolar sibilant fricative consonant	ʃ̺	http://eurasianphonology.info/search_exact?dialects=True&query=ʃ̺	ʃ̺
voiced apical post-alveolar sibilant fricative consonant	ʒ̺	http://eurasianphonology.info/search_exact?dialects=True&query=ʒ̺	ʒ̺
lowered front unrounded close front vowel	i̞	http://eurasianphonology.info/search_exact?dialects=True&query=i̞	i̞
lowered back rounded close back vowel	u̞	http://eurasianphonology.info/search_exact?dialects=True&query=u̞	u̞
long lowered front unrounded close front vowel	i̞ː	http://eurasianphonology.info/search_exact?dialects=True&query=i̞ː	i̞ː
long lowered back rounded close back vowel	u̞ː	http://eurasianphonology.info/search_exact?dialects=True&query=u̞ː	u̞ː
from non-syllabic near-front unrounded near-close near-front to back rounded open-mid back diphthong	ɪ̯ɔ	http://eurasianphonology.info/search_exact?dialects=True&query=ɪ̯ɔ	ɪ̯ɔ
from non-syllabic near-front unrounded near-close near-front to lowered back rounded close back diphthong	ɪ̯u̞	http://eurasianphonology.info/search_exact?dialects=True&query=ɪ̯u̞	ɪ̯u̞
from non-syllabic near-back rounded near-close near-back to back rounded open-mid back diphthong	ʊ̯ɔ	http://eurasianphonology.info/search_exact?dialects=True&query=ʊ̯ɔ	ʊ̯ɔ
devoiced voiced labialized-velar approximant consonant	w̥	http://eurasianphonology.info/search_exact?dialects=True&query=w̥	w̥
voiced labialized-palatal approximant consonant	ɥ	http://eurasianphonology.info/search_exact?dialects=True&query=ɥ	ɥ
front nasalized rounded open-mid front vowel	œ̃	http://eurasianphonology.info/search_exact?dialects=True&query=œ̃	œ̃
from central unrounded mid central to front rounded close front diphthong	əy	http://eurasianphonology.info/search_exact?dialects=True&query=əy	əy
voiceless laminal dental stop consonant	t̪̻	http://eurasianphonology.info/search_exact?dialects=True&query=t̪̻	t̪̻
voiced laminal dental stop consonant	d̪̻	http://eurasianphonology.info/search_exact?dialects=True&query=d̪̻	d̪̻
voiceless laminal dental sibilant fricative consonant	s̪̻	http://eurasianphonology.info/search_exact?dialects=True&query=s̪̻	s̪̻
voiced laminal dental sibilant fricative consonant	z̪̻	http://eurasianphonology.info/search_exact?dialects=True&query=z̪̻	z̪̻
from voiceless laminal dental stop to voiceless laminal dental sibilant fricative cluster	t̪̻s̪̻	http://eurasianphonology.info/search_exact?dialects=True&query=t̪̻s̪̻	t̪̻s̪̻
from voiceless laminal alveolar stop to voiceless laminal post-alveolar sibilant fricative cluster	t̻ʃ̻	http://eurasianphonology.info/search_exact?dialects=True&query=t̻ʃ̻	t̻ʃ̻
from voiced laminal alveolar stop to voiced laminal post-alveolar sibilant fricative cluster	d̻ʒ̻	http://eurasianphonology.info/search_exact?dialects=True&query=d̻ʒ̻	d̻ʒ̻
from voiceless apical alveolar stop to labialized voiceless apical post-alveolar sibilant fricative cluster	t̺ʃ̺ʷ	http://eurasianphonology.info/search_exact?dialects=True&query=t̺ʃ̺ʷ	t̺ʃ̺ʷ
from voiced apical alveolar stop to labialized voiced apical post-alveolar sibilant fricative cluster	d̺ʒ̺ʷ	http://eurasianphonology.info/search_exact?dialects=True&query=d̺ʒ̺ʷ	d̺ʒ̺ʷ
breathy voiced bilabial stop consonant	bʱ	http://eurasianphonology.info/search_exact?dialects=True&query=bʱ	bʱ
breathy voiced bilabial nasal consonant	mʱ	http://eurasianphonology.info/search_exact?dialects=True&query=mʱ	mʱ
breathy voiced dental stop consonant	d̪ʱ	http://eurasianphonology.info/search_exact?dialects=True&query=d̪ʱ	d̪ʱ
breathy voiced dental lateral approximant consonant	l̪ʱ	http://eurasianphonology.info/search_exact?dialects=True&query=l̪ʱ	l̪ʱ
voiced bilabial implosive consonant	ɓ	http://eurasianphonology.info/search_exact?dialects=True&query=ɓ	ɓ
breathy voiced alveolar nasal consonant	nʱ	http://eurasianphonology.info/search_exact?dialects=True&query=nʱ	nʱ
voiced dental implosive consonant	ɗ	http://eurasianphonology.info/search_exact?dialects=True&query=ɗ	ɗ
breathy voiced retroflex stop consonant	ɖʱ	http://eurasianphonology.info/search_exact?dialects=True&query=ɖʱ	ɖʱ
breathy voiced retroflex nasal consonant	ɳʱ	http://eurasianphonology.info/search_exact?dialects=True&query=ɳʱ	ɳʱ
breathy voiced retroflex tap consonant	ɽʱ	http://eurasianphonology.info/search_exact?dialects=True&query=ɽʱ	ɽʱ
from voiceless laminal alveolar stop to voiceless laminal alveolo-palatal sibilant fricative cluster	t̻ɕ̻	http://eurasianphonology.info/search_exact?dialects=True&query=t̻ɕ̻	t̻ɕ̻
from voiceless laminal alveolar stop to aspirated voiceless laminal alveolo-palatal sibilant fricative cluster	t̻ɕ̻ʰ	http://eurasianphonology.info/search_exact?dialects=True&query=t̻ɕ̻ʰ	t̻ɕ̻ʰ
from voiced laminal alveolar stop to voiced laminal alveolo-palatal sibilant fricative cluster	d̻ʑ̻	http://eurasianphonology.info/search_exact?dialects=True&query=d̻ʑ̻	d̻ʑ̻
from voiced laminal alveolar stop to breathy voiced laminal alveolo-palatal sibilant fricative cluster	d̻ʑ̻ʱ	http://eurasianphonology.info/search_exact?dialects=True&query=d̻ʑ̻ʱ	d̻ʑ̻ʱ
voiced palatal implosive consonant	ʄ	http://eurasianphonology.info/search_exact?dialects=True&query=ʄ	ʄ
breathy voiced velar stop consonant	gʱ	http://eurasianphonology.info/search_exact?dialects=True&query=gʱ	gʱ
voiced velar implosive consonant	ɠ	http://eurasianphonology.info/search_exact?dialects=True&query=ɠ	ɠ
ultra-short near-front unrounded near-close near-front vowel	ɪ̆	http://eurasianphonology.info/search_exact?dialects=True&query=ɪ̆	ɪ̆
ultra-short near-back rounded near-close near-back vowel	ʊ̆	http://eurasianphonology.info/search_exact?dialects=True&query=ʊ̆	ʊ̆
ultra-short central unrounded nearly-open central vowel	ɐ̆	http://eurasianphonology.info/search_exact?dialects=True&query=ɐ̆	ɐ̆
breathy voiced alveolar lateral approximant consonant	lʱ	http://eurasianphonology.info/search_exact?dialects=True&query=lʱ	lʱ
breathy voiced alveolar trill consonant	rʱ	http://eurasianphonology.info/search_exact?dialects=True&query=rʱ	rʱ
breathy voiced post-alveolar sibilant affricate consonant	dʒʱ	http://eurasianphonology.info/search_exact?dialects=True&query=dʒʱ	dʒʱ
voiceless palatal affricate consonant	cç	http://eurasianphonology.info/search_exact?dialects=True&query=cç	cç
aspirated voiceless palatal affricate consonant	cçʰ	http://eurasianphonology.info/search_exact?dialects=True&query=cçʰ	cçʰ
pharyngealized voiceless dental stop consonant	t̪ˤ	http://eurasianphonology.info/search_exact?dialects=True&query=t̪ˤ	t̪ˤ
pharyngealized voiceless dental sibilant fricative consonant	s̪ˤ	http://eurasianphonology.info/search_exact?dialects=True&query=s̪ˤ	s̪ˤ
pharyngealized voiced dental sibilant fricative consonant	z̪ˤ	http://eurasianphonology.info/search_exact?dialects=True&query=z̪ˤ	z̪ˤ
back unrounded mid back vowel	ɤ̞	http://eurasianphonology.info/search_exact?dialects=True&query=ɤ̞	ɤ̞
voiceless labialized-velar approximant consonant	ʍ	http://eurasianphonology.info/search_exact?dialects=True&query=ʍ	ʍ
voiced velar approximant consonant	ɰ	http://eurasianphonology.info/search_exact?dialects=True&query=ɰ	ɰ
back breathy unrounded close back vowel	ɯ̤	http://eurasianphonology.info/search_exact?dialects=True&query=ɯ̤	ɯ̤
front breathy unrounded close-mid front vowel	e̤	http://eurasianphonology.info/search_exact?dialects=True&query=e̤	e̤
back breathy rounded close-mid back vowel	o̤	http://eurasianphonology.info/search_exact?dialects=True&query=o̤	o̤
front breathy unrounded open front vowel	a̤	http://eurasianphonology.info/search_exact?dialects=True&query=a̤	a̤
central nasalized unrounded nearly-open central vowel	ɐ̃	http://eurasianphonology.info/search_exact?dialects=True&query=ɐ̃	ɐ̃
voiced bilabial approximant consonant	β̞	http://eurasianphonology.info/search_exact?dialects=True&query=β̞	β̞
voiced dental approximant consonant	ð̞	http://eurasianphonology.info/search_exact?dialects=True&query=ð̞	ð̞
from back rounded close back to back rounded mid back diphthong	uo̞	http://eurasianphonology.info/search_exact?dialects=True&query=uo̞	uo̞
from front rounded close front to front rounded mid front diphthong	yø̞	http://eurasianphonology.info/search_exact?dialects=True&query=yø̞	yø̞
from front rounded close front to front unrounded nearly-open front diphthong	yæ	http://eurasianphonology.info/search_exact?dialects=True&query=yæ	yæ
from front unrounded close front to front unrounded nearly-open front diphthong	iæ	http://eurasianphonology.info/search_exact?dialects=True&query=iæ	iæ
voiceless apical alveolar stop consonant	t̺	http://eurasianphonology.info/search_exact?dialects=True&query=t̺	t̺
near-back less-rounded rounded near-close near-back vowel	ʊ̜	http://eurasianphonology.info/search_exact?dialects=True&query=ʊ̜	ʊ̜
mid-long back advanced unrounded open back vowel	ɑ̟ˑ	http://eurasianphonology.info/search_exact?dialects=True&query=ɑ̟ˑ	ɑ̟ˑ
raised back advanced unrounded open back vowel	ɑ̝̟	http://eurasianphonology.info/search_exact?dialects=True&query=ɑ̝̟	ɑ̝̟
mid-long back advanced rounded close-mid back vowel	o̟ˑ	http://eurasianphonology.info/search_exact?dialects=True&query=o̟ˑ	o̟ˑ
central rounded open-mid central vowel	ɞ	http://eurasianphonology.info/search_exact?dialects=True&query=ɞ	ɞ
central rounded near-close central vowel	ʊ̈	http://eurasianphonology.info/search_exact?dialects=True&query=ʊ̈	ʊ̈
mid-long lowered back rounded close back vowel	u̞ˑ	http://eurasianphonology.info/search_exact?dialects=True&query=u̞ˑ	u̞ˑ
mid-long front unrounded close-mid front vowel	eˑ	http://eurasianphonology.info/search_exact?dialects=True&query=eˑ	eˑ
long central rounded mid central vowel	ɵ̞ː	http://eurasianphonology.info/search_exact?dialects=True&query=ɵ̞ː	ɵ̞ː
mid-long front unrounded nearly-open front vowel	æˑ	http://eurasianphonology.info/search_exact?dialects=True&query=æˑ	æˑ
mid-long front rounded close front vowel	yˑ	http://eurasianphonology.info/search_exact?dialects=True&query=yˑ	yˑ
mid-long front rounded close-mid front vowel	øˑ	http://eurasianphonology.info/search_exact?dialects=True&query=øˑ	øˑ
mid-long back unrounded close back vowel	ɯˑ	http://eurasianphonology.info/search_exact?dialects=True&query=ɯˑ	ɯˑ
mid-long back unrounded open back vowel	ɑˑ	http://eurasianphonology.info/search_exact?dialects=True&query=ɑˑ	ɑˑ
mid-long back rounded close-mid back vowel	oˑ	http://eurasianphonology.info/search_exact?dialects=True&query=oˑ	oˑ
palatalized devoiced voiced alveolar lateral approximant consonant	l̥ʲ	http://eurasianphonology.info/search_exact?dialects=True&query=l̥ʲ	l̥ʲ
palatalized devoiced voiced alveolar trill consonant	r̥ʲ	http://eurasianphonology.info/search_exact?dialects=True&query=r̥ʲ	r̥ʲ
from central unrounded close central to non-syllabic front unrounded close front diphthong	ɨi̯	http://eurasianphonology.info/search_exact?dialects=True&query=ɨi̯	ɨi̯
from front unrounded open-mid front to non-syllabic front unrounded close front diphthong	ɛi̯	http://eurasianphonology.info/search_exact?dialects=True&query=ɛi̯	ɛi̯
ultra-short central advanced unrounded mid central vowel	ə̟̆	http://eurasianphonology.info/search_exact?dialects=True&query=ə̟̆	ə̟̆
lowered front rounded close front vowel	y̞	http://eurasianphonology.info/search_exact?dialects=True&query=y̞	y̞
central unrounded near-close central vowel	ɪ̈	http://eurasianphonology.info/search_exact?dialects=True&query=ɪ̈	ɪ̈
from voiceless apical alveolar stop to voiceless apical alveolar sibilant fricative cluster	t̺s̺	http://eurasianphonology.info/search_exact?dialects=True&query=t̺s̺	t̺s̺
lowered central rounded close central vowel	ʉ̞	http://eurasianphonology.info/search_exact?dialects=True&query=ʉ̞	ʉ̞
velarized voiceless alveolar lateral fricative consonant	ɬˠ	http://eurasianphonology.info/search_exact?dialects=True&query=ɬˠ	ɬˠ
pre-nasalized voiced dental stop consonant	ⁿd̪	http://eurasianphonology.info/search_exact?dialects=True&query=ⁿd̪	ⁿd̪
aspirated long voiceless alveolar sibilant affricate consonant	tsʰː	http://eurasianphonology.info/search_exact?dialects=True&query=tsːʰ	tsːʰ
aspirated long voiceless post-alveolar sibilant affricate consonant	tʃʰː	http://eurasianphonology.info/search_exact?dialects=True&query=tʃːʰ	tʃːʰ
aspirated long voiceless velar stop consonant	kʰː	http://eurasianphonology.info/search_exact?dialects=True&query=kːʰ	kːʰ
aspirated long voiceless alveolar lateral affricate consonant	tɬʰː	http://eurasianphonology.info/search_exact?dialects=True&query=tɬːʰ	tɬːʰ
long voiced uvular fricative consonant	ʁː	http://eurasianphonology.info/search_exact?dialects=True&query=ʁː	ʁː
aspirated voiceless uvular affricate consonant	qχʰ	http://eurasianphonology.info/search_exact?dialects=True&query=qχʰ	qχʰ
pharyngealized voiceless glottal stop consonant	ʔˤ	http://eurasianphonology.info/search_exact?dialects=True&query=ʔˤ	ʔˤ
aspirated long voiceless palatal stop consonant	cʰː	http://eurasianphonology.info/search_exact?dialects=True&query=cːʰ	cːʰ
voiceless palatal ejective stop consonant	cʼ	http://eurasianphonology.info/search_exact?dialects=True&query=cʼ	cʼ
labialized aspirated long voiceless velar stop consonant	kʷʰː	http://eurasianphonology.info/search_exact?dialects=True&query=kːʷʰ	kːʷʰ
from front unrounded open front to front unrounded close-mid front diphthong	ae	http://eurasianphonology.info/search_exact?dialects=True&query=ae	ae
