CLTS_NAME	BIPA_GRAPHEME	EURASIAN_URL	EURASIAN_GRAPHEME
voiceless bilabial stop consonant	p	http://eurasianphonology.info/search_exact?dialects=True&query=p	p
voiced bilabial stop consonant	b	http://eurasianphonology.info/search_exact?dialects=True&query=b	b
voiced bilabial nasal consonant	m	http://eurasianphonology.info/search_exact?dialects=True&query=m	m
voiceless labio-dental fricative consonant	f	http://eurasianphonology.info/search_exact?dialects=True&query=f	f
voiced labio-dental fricative consonant	v	http://eurasianphonology.info/search_exact?dialects=True&query=v	v
voiced dental fricative consonant	ð	http://eurasianphonology.info/search_exact?dialects=True&query=ð	ð
voiceless alveolar stop consonant	t	http://eurasianphonology.info/search_exact?dialects=True&query=t	t
voiced alveolar stop consonant	d	http://eurasianphonology.info/search_exact?dialects=True&query=d	d
voiced alveolar nasal consonant	n	http://eurasianphonology.info/search_exact?dialects=True&query=n	n
voiced alveolar trill consonant	r	http://eurasianphonology.info/search_exact?dialects=True&query=r	r
voiceless alveolar sibilant fricative consonant	s	http://eurasianphonology.info/search_exact?dialects=True&query=s	s
voiced alveolar sibilant fricative consonant	z	http://eurasianphonology.info/search_exact?dialects=True&query=z	z
voiceless alveolar sibilant affricate consonant	ts	http://eurasianphonology.info/search_exact?dialects=True&query=ts	ts
voiced alveolar sibilant affricate consonant	dz	http://eurasianphonology.info/search_exact?dialects=True&query=dz	dz
voiced alveolar lateral approximant consonant	l	http://eurasianphonology.info/search_exact?dialects=True&query=l	l
voiceless post-alveolar sibilant fricative consonant	ʃ	http://eurasianphonology.info/search_exact?dialects=True&query=ʃ	ʃ
voiced post-alveolar sibilant fricative consonant	ʒ	http://eurasianphonology.info/search_exact?dialects=True&query=ʒ	ʒ
voiceless post-alveolar sibilant affricate consonant	tʃ	http://eurasianphonology.info/search_exact?dialects=True&query=tʃ	tʃ
voiced post-alveolar sibilant affricate consonant	dʒ	http://eurasianphonology.info/search_exact?dialects=True&query=dʒ	dʒ
voiceless palatal stop consonant	c	http://eurasianphonology.info/search_exact?dialects=True&query=c	c
voiced palatal stop consonant	ɟ	http://eurasianphonology.info/search_exact?dialects=True&query=ɟ	ɟ
voiced palatal nasal consonant	ɲ	http://eurasianphonology.info/search_exact?dialects=True&query=ɲ	ɲ
voiced palatal fricative consonant	ʝ	http://eurasianphonology.info/search_exact?dialects=True&query=ʝ	ʝ
voiced palatal approximant consonant	j	http://eurasianphonology.info/search_exact?dialects=True&query=j	j
voiced palatal lateral approximant consonant	ʎ	http://eurasianphonology.info/search_exact?dialects=True&query=ʎ	ʎ
voiceless velar stop consonant	k	http://eurasianphonology.info/search_exact?dialects=True&query=k	k
voiced velar stop consonant	g	http://eurasianphonology.info/search_exact?dialects=True&query=g	g
voiced velar nasal consonant	ŋ	http://eurasianphonology.info/search_exact?dialects=True&query=ŋ	ŋ
voiceless velar fricative consonant	x	http://eurasianphonology.info/search_exact?dialects=True&query=x	x
voiced velar fricative consonant	ɣ	http://eurasianphonology.info/search_exact?dialects=True&query=ɣ	ɣ
voiced labialized-velar approximant consonant	w	http://eurasianphonology.info/search_exact?dialects=True&query=w	w
palatalized voiceless bilabial stop consonant	pʲ	http://eurasianphonology.info/search_exact?dialects=True&query=pʲ	pʲ
palatalized voiced bilabial stop consonant	bʲ	http://eurasianphonology.info/search_exact?dialects=True&query=bʲ	bʲ
palatalized voiced bilabial nasal consonant	mʲ	http://eurasianphonology.info/search_exact?dialects=True&query=mʲ	mʲ
palatalized voiceless labio-dental fricative consonant	fʲ	http://eurasianphonology.info/search_exact?dialects=True&query=fʲ	fʲ
palatalized voiced labio-dental fricative consonant	vʲ	http://eurasianphonology.info/search_exact?dialects=True&query=vʲ	vʲ
palatalized voiced dental fricative consonant	ðʲ	http://eurasianphonology.info/search_exact?dialects=True&query=ðʲ	ðʲ
palatalized voiceless alveolar stop consonant	tʲ	http://eurasianphonology.info/search_exact?dialects=True&query=tʲ	tʲ
palatalized voiced alveolar stop consonant	dʲ	http://eurasianphonology.info/search_exact?dialects=True&query=dʲ	dʲ
palatalized voiced alveolar nasal consonant	nʲ	http://eurasianphonology.info/search_exact?dialects=True&query=nʲ	nʲ
palatalized voiced alveolar trill consonant	rʲ	http://eurasianphonology.info/search_exact?dialects=True&query=rʲ	rʲ
palatalized voiceless alveolar sibilant fricative consonant	sʲ	http://eurasianphonology.info/search_exact?dialects=True&query=sʲ	sʲ
palatalized voiced alveolar sibilant fricative consonant	zʲ	http://eurasianphonology.info/search_exact?dialects=True&query=zʲ	zʲ
palatalized voiceless alveolar sibilant affricate consonant	tsʲ	http://eurasianphonology.info/search_exact?dialects=True&query=tsʲ	tsʲ
palatalized voiced alveolar sibilant affricate consonant	dzʲ	http://eurasianphonology.info/search_exact?dialects=True&query=dzʲ	dzʲ
palatalized voiced alveolar lateral approximant consonant	lʲ	http://eurasianphonology.info/search_exact?dialects=True&query=lʲ	lʲ
palatalized voiceless post-alveolar sibilant fricative consonant	ʃʲ	http://eurasianphonology.info/search_exact?dialects=True&query=ʃʲ	ʃʲ
palatalized voiced post-alveolar sibilant fricative consonant	ʒʲ	http://eurasianphonology.info/search_exact?dialects=True&query=ʒʲ	ʒʲ
palatalized voiceless post-alveolar sibilant affricate consonant	tʃʲ	http://eurasianphonology.info/search_exact?dialects=True&query=tʃʲ	tʃʲ
palatalized voiced post-alveolar sibilant affricate consonant	dʒʲ	http://eurasianphonology.info/search_exact?dialects=True&query=dʒʲ	dʒʲ
voiceless palatal sibilant fricative consonant	ç	http://eurasianphonology.info/search_exact?dialects=True&query=ç	ç
front unrounded close front vowel	i	http://eurasianphonology.info/search_exact?dialects=True&query=i	i
front unrounded open-mid front vowel	ɛ	http://eurasianphonology.info/search_exact?dialects=True&query=ɛ	ɛ
front unrounded close-mid front vowel	e	http://eurasianphonology.info/search_exact?dialects=True&query=e	e
front advanced unrounded open front vowel	a̟	http://eurasianphonology.info/search_exact?dialects=True&query=a̟	a̟
central unrounded nearly-open central vowel	ɐ	http://eurasianphonology.info/search_exact?dialects=True&query=ɐ	ɐ
central unrounded mid central vowel	ə	http://eurasianphonology.info/search_exact?dialects=True&query=ə	ə
back unrounded open back vowel	ɑ	http://eurasianphonology.info/search_exact?dialects=True&query=ɑ	ɑ
back rounded open-mid back vowel	ɔ	http://eurasianphonology.info/search_exact?dialects=True&query=ɔ	ɔ
back rounded close-mid back vowel	o	http://eurasianphonology.info/search_exact?dialects=True&query=o	o
back rounded close back vowel	u	http://eurasianphonology.info/search_exact?dialects=True&query=u	u
ultra-short back unrounded open back vowel	ɑ̆	http://eurasianphonology.info/search_exact?dialects=True&query=ɑ̆	ɑ̆
ultra-short front unrounded close-mid front vowel	ĕ	http://eurasianphonology.info/search_exact?dialects=True&query=ĕ	ĕ
from front unrounded open-mid front to front advanced unrounded open front diphthong	ɛa̟	http://eurasianphonology.info/search_exact?dialects=True&query=ɛa̟	ɛa̟
from front unrounded open-mid front to central unrounded nearly-open central diphthong	ɛɐ	http://eurasianphonology.info/search_exact?dialects=True&query=ɛɐ	ɛɐ
from front unrounded close front to central unrounded nearly-open central diphthong	iɐ	http://eurasianphonology.info/search_exact?dialects=True&query=iɐ	iɐ
from front unrounded close front to central unrounded mid central diphthong	iə	http://eurasianphonology.info/search_exact?dialects=True&query=iə	iə
from back rounded close back to central unrounded mid central diphthong	uə	http://eurasianphonology.info/search_exact?dialects=True&query=uə	uə
from back rounded close back to central unrounded nearly-open central diphthong	uɐ	http://eurasianphonology.info/search_exact?dialects=True&query=uɐ	uɐ
from back rounded close back to front advanced unrounded open front diphthong	ua̟	http://eurasianphonology.info/search_exact?dialects=True&query=ua̟	ua̟
from back rounded close back to back rounded open-mid back diphthong	uɔ	http://eurasianphonology.info/search_exact?dialects=True&query=uɔ	uɔ
from back rounded close back to front unrounded close-mid front diphthong	ue	http://eurasianphonology.info/search_exact?dialects=True&query=ue	ue
from front unrounded close front to front unrounded close-mid front diphthong	ie	http://eurasianphonology.info/search_exact?dialects=True&query=ie	ie
long front unrounded close front vowel	iː	http://eurasianphonology.info/search_exact?dialects=True&query=ii	ii
from back rounded close back to front unrounded close front diphthong	ui	http://eurasianphonology.info/search_exact?dialects=True&query=ui	ui
voiceless apical alveolar sibilant fricative consonant	s̺	http://eurasianphonology.info/search_exact?dialects=True&query=s̺	s̺
voiceless alveolo-palatal sibilant affricate consonant	tɕ	http://eurasianphonology.info/search_exact?dialects=True&query=tɕ	tɕ
voiceless glottal stop consonant	ʔ	http://eurasianphonology.info/search_exact?dialects=True&query=ʔ	ʔ
central unrounded close central vowel	ɨ	http://eurasianphonology.info/search_exact?dialects=True&query=ɨ	ɨ
back advanced rounded close back vowel	u̟	http://eurasianphonology.info/search_exact?dialects=True&query=u̟	u̟
front rounded close front vowel	y	http://eurasianphonology.info/search_exact?dialects=True&query=y	y
back less-rounded advanced rounded open-mid back vowel	ɔ̜̟	http://eurasianphonology.info/search_exact?dialects=True&query=ɔ̟̜	ɔ̟̜
front unrounded open front vowel	a	http://eurasianphonology.info/search_exact?dialects=True&query=a	a
from non-syllabic back rounded close back to back unrounded open back diphthong	u̯ɑ	http://eurasianphonology.info/search_exact?dialects=True&query=u̯ɑ	u̯ɑ
voiceless dental stop consonant	t̪	http://eurasianphonology.info/search_exact?dialects=True&query=t̪	t̪
voiced dental stop consonant	d̪	http://eurasianphonology.info/search_exact?dialects=True&query=d̪	d̪
devoiced voiced alveolar tap consonant	ɾ	http://eurasianphonology.info/search_exact?dialects=True&query=ɾ	ɾ
devoiced voiced bilabial stop consonant	b̥	http://eurasianphonology.info/search_exact?dialects=True&query=b̥	b̥
voiceless labio-dental affricate consonant	pf	http://eurasianphonology.info/search_exact?dialects=True&query=pf	pf
devoiced voiced labio-dental fricative consonant	v̥	http://eurasianphonology.info/search_exact?dialects=True&query=v̥	v̥
voiced labio-dental approximant consonant	ʋ	http://eurasianphonology.info/search_exact?dialects=True&query=ʋ	ʋ
devoiced voiced alveolar stop consonant	d̥	http://eurasianphonology.info/search_exact?dialects=True&query=d̥	d̥
voiced uvular trill consonant	ʀ	http://eurasianphonology.info/search_exact?dialects=True&query=ʀ	ʀ
devoiced voiced alveolar sibilant fricative consonant	z̥	http://eurasianphonology.info/search_exact?dialects=True&query=z̥	z̥
devoiced voiced post-alveolar sibilant fricative consonant	ʒ̊	http://eurasianphonology.info/search_exact?dialects=True&query=ʒ̊	ʒ̊
devoiced voiced velar stop consonant	g̊	http://eurasianphonology.info/search_exact?dialects=True&query=g̊	g̊
voiceless velar affricate consonant	kx	http://eurasianphonology.info/search_exact?dialects=True&query=kx	kx
devoiced voiced velar fricative consonant	ɣ̊	http://eurasianphonology.info/search_exact?dialects=True&query=ɣ̊	ɣ̊
voiceless glottal fricative consonant	h	http://eurasianphonology.info/search_exact?dialects=True&query=h	h
long front unrounded close front vowel	iː	http://eurasianphonology.info/search_exact?dialects=True&query=iː	iː
long front unrounded close-mid front vowel	eː	http://eurasianphonology.info/search_exact?dialects=True&query=eː	eː
long front unrounded open-mid front vowel	ɛː	http://eurasianphonology.info/search_exact?dialects=True&query=ɛː	ɛː
front unrounded nearly-open front vowel	æ	http://eurasianphonology.info/search_exact?dialects=True&query=æ	æ
long front unrounded nearly-open front vowel	æː	http://eurasianphonology.info/search_exact?dialects=True&query=æː	æː
long front rounded close front vowel	yː	http://eurasianphonology.info/search_exact?dialects=True&query=yː	yː
front rounded close-mid front vowel	ø	http://eurasianphonology.info/search_exact?dialects=True&query=ø	ø
long front rounded close-mid front vowel	øː	http://eurasianphonology.info/search_exact?dialects=True&query=øː	øː
long front rounded open-mid front vowel	œː	http://eurasianphonology.info/search_exact?dialects=True&query=œː	œː
long back rounded close back vowel	uː	http://eurasianphonology.info/search_exact?dialects=True&query=uː	uː
long back rounded close-mid back vowel	oː	http://eurasianphonology.info/search_exact?dialects=True&query=oː	oː
back rounded open back vowel	ɒ	http://eurasianphonology.info/search_exact?dialects=True&query=ɒ	ɒ
long back rounded open back vowel	ɒː	http://eurasianphonology.info/search_exact?dialects=True&query=ɒː	ɒː
from front unrounded close-mid front to non-syllabic front unrounded close front diphthong	ei̯	http://eurasianphonology.info/search_exact?dialects=True&query=ei̯	ei̯
from front unrounded nearly-open front to non-syllabic front unrounded close front diphthong	æi̯	http://eurasianphonology.info/search_exact?dialects=True&query=æi̯	æi̯
from back rounded close-mid back to non-syllabic front unrounded close front diphthong	oi̯	http://eurasianphonology.info/search_exact?dialects=True&query=oi̯	oi̯
from front unrounded close front to non-syllabic central unrounded mid central diphthong	iə̯	http://eurasianphonology.info/search_exact?dialects=True&query=iə̯	iə̯
from front rounded close front to non-syllabic central unrounded mid central diphthong	yə̯	http://eurasianphonology.info/search_exact?dialects=True&query=yə̯	yə̯
from back rounded close back to non-syllabic central unrounded mid central diphthong	uə̯	http://eurasianphonology.info/search_exact?dialects=True&query=uə̯	uə̯
from front unrounded nearly-open front to non-syllabic back rounded close back diphthong	æu̯	http://eurasianphonology.info/search_exact?dialects=True&query=æu̯	æu̯
from back rounded close-mid back to non-syllabic back rounded close back diphthong	ou̯	http://eurasianphonology.info/search_exact?dialects=True&query=ou̯	ou̯
aspirated voiceless bilabial stop consonant	pʰ	http://eurasianphonology.info/search_exact?dialects=True&query=pʰ	pʰ
aspirated voiceless alveolar stop consonant	tʰ	http://eurasianphonology.info/search_exact?dialects=True&query=tʰ	tʰ
voiceless retroflex stop consonant	ʈ	http://eurasianphonology.info/search_exact?dialects=True&query=ʈ	ʈ
voiced retroflex stop consonant	ɖ	http://eurasianphonology.info/search_exact?dialects=True&query=ɖ	ɖ
voiced retroflex nasal consonant	ɳ	http://eurasianphonology.info/search_exact?dialects=True&query=ɳ	ɳ
voiceless retroflex sibilant fricative consonant	ʂ	http://eurasianphonology.info/search_exact?dialects=True&query=ʂ	ʂ
voiced retroflex tap consonant	ɽ	http://eurasianphonology.info/search_exact?dialects=True&query=ɽ	ɽ
voiced retroflex lateral approximant consonant	ɭ	http://eurasianphonology.info/search_exact?dialects=True&query=ɭ	ɭ
aspirated voiceless velar stop consonant	kʰ	http://eurasianphonology.info/search_exact?dialects=True&query=kʰ	kʰ
long central rounded close central vowel	ʉː	http://eurasianphonology.info/search_exact?dialects=True&query=ʉː	ʉː
long back unrounded open back vowel	ɑː	http://eurasianphonology.info/search_exact?dialects=True&query=ɑː	ɑː
central rounded close central vowel	ʉ	http://eurasianphonology.info/search_exact?dialects=True&query=ʉ	ʉ
front rounded open-mid front vowel	œ	http://eurasianphonology.info/search_exact?dialects=True&query=œ	œ
voiced dental nasal consonant	n̪	http://eurasianphonology.info/search_exact?dialects=True&query=n̪	n̪
palatalized voiced dental lateral approximant consonant	l̪ʲ	http://eurasianphonology.info/search_exact?dialects=True&query=l̪ʲ	l̪ʲ
front rounded mid front vowel	ø̞	http://eurasianphonology.info/search_exact?dialects=True&query=ø̞	ø̞
back rounded mid back vowel	o̞	http://eurasianphonology.info/search_exact?dialects=True&query=o̞	o̞
central unrounded open-mid central vowel	ɜ	http://eurasianphonology.info/search_exact?dialects=True&query=ɜ	ɜ
from front unrounded close front to front unrounded mid front diphthong	ie̞	http://eurasianphonology.info/search_exact?dialects=True&query=ie̞	ie̞
long central unrounded open-mid central vowel	ɜː	http://eurasianphonology.info/search_exact?dialects=True&query=ɜː	ɜː
long back rounded mid back vowel	o̞ː	http://eurasianphonology.info/search_exact?dialects=True&query=o̞ː	o̞ː
front creaky unrounded nearly-open front vowel	æ̰	http://eurasianphonology.info/search_exact?dialects=True&query=æ̰	æ̰
front creaky unrounded open front vowel	a̰	http://eurasianphonology.info/search_exact?dialects=True&query=a̰	a̰
front creaky unrounded mid front vowel	e̞̰	http://eurasianphonology.info/search_exact?dialects=True&query=e̞̰	e̞̰
central creaky rounded mid central vowel	ɵ̞̰	http://eurasianphonology.info/search_exact?dialects=True&query=ɵ̞̰	ɵ̞̰
voiceless bilabial ejective stop consonant	pʼ	http://eurasianphonology.info/search_exact?dialects=True&query=pʼ	pʼ
labialized voiceless bilabial ejective stop consonant	pʼʷ	http://eurasianphonology.info/search_exact?dialects=True&query=pʼʷ	pʼʷ
voiceless alveolar ejective stop consonant	tʼ	http://eurasianphonology.info/search_exact?dialects=True&query=tʼ	tʼ
labialized voiceless alveolar ejective stop consonant	tʼʷ	http://eurasianphonology.info/search_exact?dialects=True&query=tʼʷ	tʼʷ
labialized voiced velar stop consonant	gʷ	http://eurasianphonology.info/search_exact?dialects=True&query=ɡʷ	ɡʷ
labialized voiceless velar stop consonant	kʷ	http://eurasianphonology.info/search_exact?dialects=True&query=kʷ	kʷ
voiceless velar ejective stop consonant	kʼ	http://eurasianphonology.info/search_exact?dialects=True&query=kʼ	kʼ
labialized voiceless velar ejective stop consonant	kʼʷ	http://eurasianphonology.info/search_exact?dialects=True&query=kʼʷ	kʼʷ
voiceless uvular stop consonant	q	http://eurasianphonology.info/search_exact?dialects=True&query=q	q
labialized voiceless uvular stop consonant	qʷ	http://eurasianphonology.info/search_exact?dialects=True&query=qʷ	qʷ
voiceless glottal ejective stop consonant	ʔ’	http://eurasianphonology.info/search_exact?dialects=True&query=ʔʼ	ʔʼ
labialized voiceless glottal ejective stop consonant	ʔ’ʷ	http://eurasianphonology.info/search_exact?dialects=True&query=ʔʼʷ	ʔʼʷ
voiceless alveolar ejective sibilant affricate consonant	tsʼ	http://eurasianphonology.info/search_exact?dialects=True&query=tsʼ	tsʼ
voiceless post-alveolar ejective sibilant affricate consonant	tʃʼ	http://eurasianphonology.info/search_exact?dialects=True&query=tʃʼ	tʃʼ
voiced alveolo-palatal sibilant fricative consonant	ʑ	http://eurasianphonology.info/search_exact?dialects=True&query=ʑ	ʑ
voiceless alveolo-palatal sibilant fricative consonant	ɕ	http://eurasianphonology.info/search_exact?dialects=True&query=ɕ	ɕ
voiced alveolo-palatal sibilant affricate consonant	dʑ	http://eurasianphonology.info/search_exact?dialects=True&query=dʑ	dʑ
voiceless alveolo-palatal ejective sibilant affricate consonant	tɕ’	http://eurasianphonology.info/search_exact?dialects=True&query=tɕʼ	tɕʼ
voiced alveolar lateral fricative consonant	ɮ	http://eurasianphonology.info/search_exact?dialects=True&query=ɮ	ɮ
voiceless alveolar lateral fricative consonant	ɬ	http://eurasianphonology.info/search_exact?dialects=True&query=ɬ	ɬ
voiceless alveolar ejective lateral fricative consonant	ɬʼ	http://eurasianphonology.info/search_exact?dialects=True&query=ɬʼ	ɬʼ
labialized voiceless velar fricative consonant	xʷ	http://eurasianphonology.info/search_exact?dialects=True&query=xʷ	xʷ
voiced uvular fricative consonant	ʁ	http://eurasianphonology.info/search_exact?dialects=True&query=ʁ	ʁ
labialized voiced uvular fricative consonant	ʁʷ	http://eurasianphonology.info/search_exact?dialects=True&query=ʁʷ	ʁʷ
voiceless uvular fricative consonant	χ	http://eurasianphonology.info/search_exact?dialects=True&query=χ	χ
labialized voiceless uvular fricative consonant	χʷ	http://eurasianphonology.info/search_exact?dialects=True&query=χʷ	χʷ
pharyngealized voiceless epiglottal stop consonant	ʡˤ	http://eurasianphonology.info/search_exact?dialects=True&query=ʡˤ	ʡˤ
pharyngealized voiceless uvular stop consonant	qˤ	http://eurasianphonology.info/search_exact?dialects=True&query=qˤ	qˤ
voiced dental lateral approximant consonant	l̪	http://eurasianphonology.info/search_exact?dialects=True&query=l̪	l̪
palatalized voiced dental nasal consonant	n̪ʲ	http://eurasianphonology.info/search_exact?dialects=True&query=n̪ʲ	n̪ʲ
ultra-short lowered central unrounded mid central vowel	ə̞̆	http://eurasianphonology.info/search_exact?dialects=True&query=ə̞̆	ə̞̆
long back less-rounded rounded mid back vowel	o̞̜ː	http://eurasianphonology.info/search_exact?dialects=True&query=o̞̜ː	o̞̜ː
long front unrounded mid front vowel	e̞ː	http://eurasianphonology.info/search_exact?dialects=True&query=e̞ː	e̞ː
aspirated voiceless laminal alveolar stop consonant	t̻ʰ	http://eurasianphonology.info/search_exact?dialects=True&query=t̻ʰ	t̻ʰ
voiced laminal alveolar stop consonant	d̻	http://eurasianphonology.info/search_exact?dialects=True&query=d̻	d̻
aspirated voiceless palatal stop consonant	cʰ	http://eurasianphonology.info/search_exact?dialects=True&query=cʰ	cʰ
aspirated voiceless post-alveolar sibilant affricate consonant	tʃʰ	http://eurasianphonology.info/search_exact?dialects=True&query=tʃʰ	tʃʰ
voiceless laminal alveolar sibilant fricative consonant	s̻	http://eurasianphonology.info/search_exact?dialects=True&query=s̻	s̻
voiced laminal alveolar sibilant fricative consonant	z̻	http://eurasianphonology.info/search_exact?dialects=True&query=z̻	z̻
voiced laminal alveolar nasal consonant	n̻	http://eurasianphonology.info/search_exact?dialects=True&query=n̻	n̻
voiced laminal alveolar lateral approximant consonant	l̻	http://eurasianphonology.info/search_exact?dialects=True&query=l̻	l̻
devoiced voiced laminal alveolar tap consonant	ɾ̻	http://eurasianphonology.info/search_exact?dialects=True&query=ɾ̻	ɾ̻
front unrounded mid front vowel	e̞	http://eurasianphonology.info/search_exact?dialects=True&query=e̞	e̞
back unrounded close back vowel	ɯ	http://eurasianphonology.info/search_exact?dialects=True&query=ɯ	ɯ
long back unrounded close back vowel	ɯː	http://eurasianphonology.info/search_exact?dialects=True&query=ɯː	ɯː
aspirated long voiceless bilabial stop consonant	pʰː	http://eurasianphonology.info/search_exact?dialects=True&query=pːʰ	pːʰ
long voiceless alveolar stop consonant	tː	http://eurasianphonology.info/search_exact?dialects=True&query=tː	tː
long voiceless alveolar sibilant fricative consonant	sː	http://eurasianphonology.info/search_exact?dialects=True&query=sː	sː
long voiceless post-alveolar sibilant fricative consonant	ʃː	http://eurasianphonology.info/search_exact?dialects=True&query=ʃː	ʃː
long voiceless palatal affricate consonant	cçː	http://eurasianphonology.info/search_exact?dialects=True&query=cçː	cçː
from devoiced voiced palatal stop to devoiced voiced palatal fricative cluster	ɟ̥ʝ̥	http://eurasianphonology.info/search_exact?dialects=True&query=ɟ̥ʝ̥	ɟ̥ʝ̥
nasalized voiced palatal approximant consonant	j̃	http://eurasianphonology.info/search_exact?dialects=True&query=j̃	j̃
long voiceless velar stop consonant	kː	http://eurasianphonology.info/search_exact?dialects=True&query=kː	kː
long voiceless uvular stop consonant	qː	http://eurasianphonology.info/search_exact?dialects=True&query=qː	qː
devoiced voiced uvular stop consonant	ɢ̥	http://eurasianphonology.info/search_exact?dialects=True&query=ɢ̥	ɢ̥
nasalized palatalized voiceless pharyngeal fricative consonant	ħ̃ʲ	http://eurasianphonology.info/search_exact?dialects=True&query=ħ̃ʲ	ħ̃ʲ
voiceless pharyngeal fricative consonant	ħ	http://eurasianphonology.info/search_exact?dialects=True&query=ħ	ħ
long front unrounded open front vowel	aː	http://eurasianphonology.info/search_exact?dialects=True&query=aː	aː
back less-rounded advanced creaky rounded open-mid back vowel	ɔ̜̟̰	http://eurasianphonology.info/search_exact?dialects=True&query=ɔ̟̜̰	ɔ̟̜̰
long back less-rounded advanced rounded open-mid back vowel	ɔ̜̟ː	http://eurasianphonology.info/search_exact?dialects=True&query=ɔ̟̜ː	ɔ̟̜ː
back creaky rounded close back vowel	ṵ	http://eurasianphonology.info/search_exact?dialects=True&query=ṵ	ṵ
lowered central unrounded close central vowel	ɨ̞	http://eurasianphonology.info/search_exact?dialects=True&query=ɨ̞	ɨ̞
lowered central creaky unrounded close central vowel	ɨ̞̰	http://eurasianphonology.info/search_exact?dialects=True&query=ɨ̞̰	ɨ̞̰
long lowered central unrounded close central vowel	ɨ̞ː	http://eurasianphonology.info/search_exact?dialects=True&query=ɨ̞ː	ɨ̞ː
front creaky unrounded open-mid front vowel	ɛ̰	http://eurasianphonology.info/search_exact?dialects=True&query=ɛ̰	ɛ̰
central less-rounded rounded open-mid central vowel	ɞ̜	http://eurasianphonology.info/search_exact?dialects=True&query=ɞ̜	ɞ̜
